id,name,type,alias,description,source,note,source_file
S079,气喘,症状,,呼吸困难，气息急促,《中医诊断学》,,symptom.json
S080,痰多,症状,,咳痰量多,《中医诊断学》,痰湿,symptom.json
S081,痰黄稠,症状,,咳痰色黄质稠,《中医诊断学》,痰热壅肺,symptom.json
S082,痰白清稀,症状,,咳痰色白质稀,《中医诊断学》,寒痰或湿痰,symptom.json
S083,咽痛,症状,,咽喉疼痛,《中医诊断学》,肺胃热盛,symptom.json
S084,声音嘶哑,症状,,发声不扬，音质嘶哑,《中医诊断学》,肺阴虚或外邪束肺,symptom.json
S085,鼻塞,症状,,鼻腔不通畅,《中医诊断学》,表证常见,symptom.json
S086,流涕,症状,,鼻流清涕或浊涕,《中医诊断学》,风寒或风热,symptom.json
S087,目赤,症状,,眼目红赤,《中医诊断学》,肝火上炎,symptom.json
S088,视物模糊,症状,,视物不清,《中医诊断学》,肝血不足或肝肾阴虚,symptom.json
S089,眼干涩,症状,,两目干涩不适,《中医诊断学》,阴血亏虚,symptom.json
S090,皮肤干燥,症状,,皮肤缺乏润泽,《中医诊断学》,阴血不足,symptom.json
S091,皮肤瘙痒,症状,,皮肤发痒,《中医诊断学》,血虚生风或湿热,symptom.json
S092,面色黧黑,症状,,面部晦暗黧黑,《中医诊断学》,肾虚血瘀,symptom.json
S093,面色青紫,症状,,面部青紫,《中医诊断学》,气滞血瘀,symptom.json
S094,指甲淡白,症状,,爪甲淡白无华,《中医诊断学》,血虚,symptom.json
S095,脱发,症状,,头发异常脱落,《中医诊断学》,肾虚或血虚,symptom.json
S096,白发,症状,,头发早白,《中医诊断学》,肝肾亏虚,symptom.json
S097,牙齿松动,症状,,牙齿动摇不固,《中医诊断学》,肾虚,symptom.json
S098,牙龈出血,症状,,齿龈出血,《中医诊断学》,胃热或气不摄血,symptom.json
S099,口臭,症状,,口中气味臭秽,《中医诊断学》,胃热或食积,symptom.json
S100,口中黏腻,症状,,口中不爽，黏腻不清,《中医诊断学》,湿浊内蕴,symptom.json
S101,反酸,症状,,胃中酸水上泛,《中医诊断学》,肝胃不和,symptom.json
S102,嗳气,症状,,胃气上逆出嗳声,《中医诊断学》,食积或肝气犯胃,symptom.json
S103,呃逆,症状,,呃声不止,《中医诊断学》,胃气上逆,symptom.json
S104,食欲亢进,症状,消谷善饥,食欲过于旺盛,《中医诊断学》,胃热,symptom.json
S105,消化不良,症状,,进食后脘腹胀满不舒,《中医诊断学》,脾胃虚弱或食积,symptom.json
S106,肛门灼热,症状,,肛门部位灼热感,《中医诊断学》,大肠湿热,symptom.json
S107,里急后重,症状,,腹痛欲便，肛门重坠,《中医诊断学》,痢疾,symptom.json
S108,大便不爽,症状,,排便不畅，有不尽感,《中医诊断学》,气滞或湿阻,symptom.json
S109,尿频,症状,,排尿次数增多,《中医诊断学》,肾虚或湿热,symptom.json
S110,尿急,症状,,排尿急迫不能自控,《中医诊断学》,膀胱湿热,symptom.json
S111,尿痛,症状,,排尿时疼痛,《中医诊断学》,下焦湿热,symptom.json
S112,尿黄,症状,,小便色黄,《中医诊断学》,热证,symptom.json
S113,夜尿多,症状,,夜间排尿次数增多,《中医诊断学》,肾气不固,symptom.json
S114,遗精,症状,,不因性生活而精液遗泄,《中医诊断学》,肾虚,symptom.json
S115,早泄,症状,,性交时过早排精,《中医诊断学》,肾虚,symptom.json
S116,阳痿,症状,,阴茎痿软不举,《中医诊断学》,肾阳虚或肝郁,symptom.json
S117,阴囊潮湿,症状,,阴囊部潮湿黏腻,《中医诊断学》,湿热下注,symptom.json
S118,带下量多,症状,,白带量增多,《中医诊断学》,湿热或寒湿,symptom.json
S119,带下色黄,症状,,带下色黄质稠,《中医诊断学》,湿热下注,symptom.json
S120,经闭,症状,,月经停闭不行,《中医诊断学》,血虚或血瘀,symptom.json
S121,崩漏,症状,,经血非时暴下或淋漓不止,《中医诊断学》,冲任不固,symptom.json
S122,关节疼痛,症状,,肢体关节疼痛,《中医诊断学》,风寒湿痹,symptom.json
S123,关节屈伸不利,症状,,关节活动不便,《中医诊断学》,痹证,symptom.json
S124,肌肉酸痛,症状,,全身肌肉酸痛不适,《中医诊断学》,表证或湿邪,symptom.json
S125,筋脉拘急,症状,,筋脉收引，屈伸不利,《中医诊断学》,寒凝或肝血不足,symptom.json
S126,抽搐,症状,,四肢不自主抽动,《中医诊断学》,肝风内动,symptom.json
S127,震颤,症状,,肢体不自主颤抖,《中医诊断学》,肝风或血虚,symptom.json
S128,汗出不止,症状,,汗出淋漓不止,《中医诊断学》,气虚或亡阳,symptom.json
S129,半身不遂,症状,,一侧肢体不能随意运动,《中医诊断学》,中风后遗症,symptom.json
S130,口眼歪斜,症状,,口角眼睑歪斜不正,《中医诊断学》,中风或面瘫,symptom.json
S131,语言謇涩,症状,,言语艰涩不利,《中医诊断学》,中风或痰浊阻窍,symptom.json
S132,神识不清,症状,,神志昏蒙，意识不清,《中医诊断学》,热闭心包或痰蒙心窍,symptom.json
S133,烦躁不安,症状,,坐卧不宁，烦闷不安,《中医诊断学》,热扰心神,symptom.json
S134,狂躁,症状,,精神亢奋，躁动不安,《中医诊断学》,痰火扰心,symptom.json
S135,痴呆,症状,,智力减退，反应迟钝,《中医诊断学》,脑髓不足,symptom.json
S136,嗜睡,症状,,困倦多眠不易醒,《中医诊断学》,痰湿或阳气不足,symptom.json
S137,项强,症状,,颈部僵硬，转动不利,《中医诊断学》,外感风寒或落枕,symptom.json
S138,肩背痛,症状,,肩背部疼痛不适,《中医诊断学》,风湿或劳损,symptom.json
S139,下肢痿软,症状,,下肢无力，痿软难行,《中医诊断学》,肝肾亏虚或湿热,symptom.json
S140,足跟痛,症状,,足跟部疼痛,《中医诊断学》,肾虚,symptom.json
S141,虚劳,症状,,身体衰弱，诸虚不足,《中医诊断学》,气血阴阳亏虚,symptom.json
S142,消瘦,症状,,形体明显消瘦,《中医诊断学》,脾胃虚弱或阴虚,symptom.json
S143,肥胖,症状,,形体肥胖,《中医诊断学》,痰湿或气虚,symptom.json
S144,身重,症状,,身体沉重困倦,《中医诊断学》,湿困,symptom.json
S145,恶风,症状,,见风则怕冷,《中医诊断学》,表虚,symptom.json
S146,肢厥,症状,,四肢厥冷,《中医诊断学》,阳厥或寒证,symptom.json
S147,口渴喜饮,症状,,口干口渴，喜饮水,《中医诊断学》,热盛津伤,symptom.json
S148,口渴不欲饮,症状,,口干但不欲饮水,《中医诊断学》,湿邪内阻,symptom.json
S149,便血,症状,,大便带血,《中医诊断学》,肠风或湿热,symptom.json
S150,尿血,症状,,尿中带血,《中医诊断学》,热伤血络,symptom.json
S151,齿衄,症状,,牙龈出血,《中医诊断学》,胃火上炎,symptom.json
S152,鼻衄,症状,,鼻中出血,《中医诊断学》,肺热或胃火,symptom.json
S153,肌衄,症状,,皮下溢血,《中医诊断学》,血热或气虚,symptom.json
S154,吐血,症状,,吐血而出,《中医诊断学》,胃热或肝火,symptom.json
S155,咯血,症状,,咳咯出血,《中医诊断学》,肺热或阴虚,symptom.json
S156,脉结代,症状,,脉来歇止，止有定数或不定,《中医诊断学》,气血亏虚或瘀阻,symptom.json
S157,脉细数,症状,,脉细而数,《中医诊断学》,阴虚火旺,symptom.json
S158,脉滑数,症状,,脉滑而数,《中医诊断学》,痰热,symptom.json
S159,脉弦数,症状,,脉弦而数,《中医诊断学》,肝火上炎,symptom.json
S160,脉弦滑,症状,,脉弦而滑,《中医诊断学》,肝风夹痰,symptom.json
S161,心下痞硬,症状,,胃脘部堵塞满闷不适，按之硬满,《中医诊断学》,胃气虚弱，邪气逆结,symptom.json
S162,胸胁苦满,症状,,胸胁部满闷不舒,《中医诊断学》,邪犯少阳，经气不畅,symptom.json
S163,咽中如有物阻,症状,梅核气,自觉咽喉部似有物梗阻，咯之不出，咽之不下,《中医诊断学》,痰气郁结于咽喉,symptom.json
S164,奔豚气,症状,奔豚,自觉有气从少腹上冲胸咽，发作欲死，复还止,《中医诊断学》,肝肾气逆,symptom.json
S165,脏躁,症状,,精神恍惚，悲伤欲哭，不能自主,《中医诊断学》,心血不足，心神失养,symptom.json
S166,肠鸣,症状,,腹中胃肠蠕动漉漉作响,《中医诊断学》,水饮内停或肠胃不和,symptom.json
S167,疝气,症状,小肠气,腹股沟或阴囊部有肿物突起，或有疼痛,《中医诊断学》,肝气郁滞或寒湿下注,symptom.json
S168,小儿疳积,症状,疳证,形体消瘦，面黄发枯，食欲异常，肚腹胀大,《中医诊断学》,脾胃受损，气液耗伤,symptom.json
S169,惊风,症状,惊厥,小儿抽搐、昏迷，或高热、神昏,《中医诊断学》,热极生风或痰热蒙窍,symptom.json
S170,脱肛,症状,,直肠黏膜或直肠壁脱出肛门外,《中医诊断学》,中气下陷，固摄无权,symptom.json
S171,阴挺,症状,子宫脱垂,子宫位置下移，脱出阴道口外,《中医诊断学》,中气下陷，肾虚不固,symptom.json
S172,恶露不尽,症状,,产后恶露逾期不止，淋漓不断,《中医诊断学》,气虚不摄或血瘀阻滞,symptom.json
S173,产后腹痛,症状,,产后小腹疼痛，拒按或喜按,《中医诊断学》,血瘀子宫或气血亏虚,symptom.json
S174,产后发热,症状,,产褥期内出现发热，或低热不退，或高热寒战,《中医诊断学》,感染邪毒或血虚发热,symptom.json
S175,缺乳,症状,产后缺乳,产后乳汁甚少，或全无，不能满足婴儿需要,《中医诊断学》,气血亏虚或肝郁气滞,symptom.json
S176,乳痈,症状,乳腺炎,乳房局部红肿热痛，或可触及硬块，甚则化脓,《中医诊断学》,肝胃郁热，乳汁郁积,symptom.json
S177,瘰疬,症状,淋巴结结核,颈部或耳后出现大小不一的肿块，累累如串珠,《中医诊断学》,肺肾阴虚，痰火凝结,symptom.json
S178,癥瘕,症状,腹部包块,腹内结块，固定不移，或推之可动，或胀或痛,《中医诊断学》,气滞血瘀，痰湿凝结,symptom.json
S179,虚劳,症状,,五脏虚损，气血阴阳亏虚，出现一系列虚弱证候,《中医诊断学》,禀赋不足或久病失养,symptom.json
S180,肺痿,症状,,咳吐浊唾涎沫，气短，或口干咽燥,《中医诊断学》,肺脏虚损，津液耗伤,symptom.json
S181,肺痈,症状,,发热，咳嗽，胸痛，咯吐腥臭浊痰或脓血痰,《中医诊断学》,热毒瘀结于肺，肉败血腐,symptom.json
S182,肠痈,症状,阑尾炎,转移性右下腹痛，或右少腹固定压痛，可伴发热,《中医诊断学》,湿热瘀滞，肠腑不通,symptom.json
S183,缠腰火丹,症状,带状疱疹,腰部或胁肋部出现簇集性水疱，呈带状分布，疼痛剧烈,《中医诊断学》,肝经郁火，湿热毒蕴,symptom.json
S184,湿疮,症状,湿疹,皮肤出现红斑、丘疹、水疱、糜烂、渗液，瘙痒剧烈,《中医诊断学》,湿热内蕴，复感风邪,symptom.json
S185,风疹,症状,荨麻疹,皮肤出现大小不等的风团，色红或白，骤起骤退，瘙痒,《中医诊断学》,风寒束表或风热犯表,symptom.json
S186,痄腮,症状,流行性腮腺炎,耳下腮部肿胀疼痛，或伴发热、咀嚼困难,《中医诊断学》,风温邪毒壅阻少阳,symptom.json
S187,时行感冒,症状,流感,起病急，高热，乏力，头痛，周身酸痛，伴有呼吸道症状,《中医诊断学》,疫毒之邪侵犯肺卫,symptom.json
S188,疟疾,症状,,寒战、壮热、出汗，呈周期性发作,《中医诊断学》,疟邪伏于半表半里,symptom.json
S189,痢疾,症状,,腹痛，里急后重，下痢赤白脓血,《中医诊断学》,湿热疫毒结于肠腑,symptom.json
S190,黄疸,症状,,目黄、身黄、小便黄，色泽或鲜明或晦暗,《中医诊断学》,湿热蕴结或寒湿困脾,symptom.json
S191,臌胀,症状,肝硬化腹水,腹部胀大如鼓，皮色苍黄，脉络显露,《中医诊断学》,肝脾肾受损，气滞血瘀水停,symptom.json
S192,水肿,症状,,眼睑、头面、四肢或全身浮肿，按之凹陷不起,《中医诊断学》,肺脾肾功能失调，水湿泛溢,symptom.json
S193,淋证,症状,,小便频数短涩，滴沥刺痛，欲出未尽，或小腹拘急,《中医诊断学》,湿热蕴结下焦，膀胱气化不利,symptom.json
S194,癃闭,症状,尿潴留,小便点滴而出，或小便闭塞不通,《中医诊断学》,膀胱气化不利，或肾阳虚衰,symptom.json
S195,遗尿,症状,尿床,睡眠中不自主排尿，或醒后方觉,《中医诊断学》,肾气不固，膀胱失约,symptom.json
S196,消渴,症状,糖尿病,多饮、多食、多尿、形体消瘦，或尿有甜味,《中医诊断学》,阴虚燥热，脏腑受损,symptom.json
S197,痹证,症状,关节痹痛,肢体关节肌肉疼痛、酸楚、麻木、重着，或肿胀灼热,《中医诊断学》,风寒湿热之邪侵袭经络,symptom.json
S198,痿证,症状,,肢体软弱无力，肌肉萎缩，弛缓不用,《中医诊断学》,肺热叶焦或肝肾亏虚,symptom.json
S199,痉证,症状,,项背强直，四肢抽搐，甚则角弓反张,《中医诊断学》,热盛动风或阴血亏虚,symptom.json
S200,厥证,症状,,突然昏倒，不省人事，或伴四肢厥冷，但移时自醒,《中医诊断学》,气机逆乱，升降乖戾,symptom.json
S201,不寐,症状,失眠,入睡困难，或睡后易醒，醒后难以再睡，甚至彻夜不眠,《中医诊断学》,心神失养或邪扰心神,symptom.json
S202,虚烦,症状,,心胸烦热，或伴失眠、口干、心悸,《中医诊断学》,阴虚火旺或津亏血少,symptom.json
S203,神昏,症状,昏迷,神识丧失，对环境刺激无反应，或呼之不应,《中医诊断学》,热闭心包或痰蒙心窍,symptom.json
S204,谵语,症状,,神志不清，胡言乱语，妄见妄闻,《中医诊断学》,热扰心神或痰火内扰,symptom.json
S205,癫狂,症状,,精神抑郁，沉默痴呆（癫），或精神亢奋，躁狂不宁（狂）,《中医诊断学》,痰气郁结或痰火扰心,symptom.json
S206,痫证,症状,癫痫,突然仆倒，不省人事，口吐涎沫，两目上视，肢体抽搐，发作后如常,《中医诊断学》,风痰闭阻，或痰火内盛,symptom.json
S207,头痛,症状,头风,头部疼痛，或胀痛，或刺痛，或昏痛，部位不定,《中医诊断学》,外感或内伤所致清阳不升,symptom.json
S208,眩晕,症状,头晕,头晕目眩，视物旋转，或感觉自身或环境旋转,《中医诊断学》,肝阳上亢或气血亏虚,symptom.json
S209,中风,症状,脑卒中,猝然昏仆，半身不遂，口眼歪斜，言语不利,《中医诊断学》,气血逆乱，脑脉痹阻或血溢于脑,symptom.json
S210,胃痛,症状,胃脘痛,胃脘部疼痛，或胀痛，或刺痛，或隐痛，或灼痛,《中医诊断学》,寒邪客胃或肝气犯胃,symptom.json
S211,腹痛,症状,,腹部疼痛，或寒痛，或热痛，或气滞痛，或血瘀痛,《中医诊断学》,六腑不通或气血失和,symptom.json
S212,泄泻,症状,腹泻,排便次数增多，粪质稀薄，或如水样，或夹不消化食物,《中医诊断学》,脾虚湿盛或肝木乘脾,symptom.json
S213,便秘,症状,大便难,大便干燥坚硬，排便艰难，或排便间隔时间延长,《中医诊断学》,肠燥津亏或气虚无力,symptom.json
S214,咳嗽,症状,,肺气上逆，发出咳声，或伴咳痰,《中医诊断学》,外感六淫或内伤脏腑,symptom.json
S215,喘证,症状,气喘,呼吸急促，气息喘促，或张口抬肩，不能平卧,《中医诊断学》,肺肾亏虚或痰浊壅肺,symptom.json
S216,哮病,症状,哮喘,喉中哮鸣有声，呼吸急促困难，甚则喘咳不能平卧,《中医诊断学》,宿痰伏肺，遇诱因触发,symptom.json
S217,肺胀,症状,慢阻肺,胸部膨满，喘息气促，咳嗽，痰多，日久不愈,《中医诊断学》,肺脾肾虚，痰瘀阻肺,symptom.json
S218,心悸,症状,怔忡,自觉心中悸动不安，或惊惕不宁，或善惊易恐,《中医诊断学》,心血不足或痰火扰心,symptom.json
S219,胸痹,症状,冠心病,胸部闷痛，甚则胸痛彻背，喘息不得卧,《中医诊断学》,心脉痹阻或阳气虚衰,symptom.json
S220,心衰,症状,心功能不全,心悸、气喘、水肿、乏力，动则加重,《中医诊断学》,心肾阳虚，水湿泛滥,symptom.json
S221,失眠,症状,不寐,入睡困难，或睡后易醒，或彻夜难眠，或多梦纷扰,《中医诊断学》,心神失养或邪扰心神,symptom.json
S222,健忘,症状,,记忆力减退，遇事善忘，或思维迟缓,《中医诊断学》,心脾两虚或肾精不足,symptom.json
S223,郁证,症状,抑郁症,心情抑郁，情绪不宁，或善怒易哭，或咽中如有物阻,《中医诊断学》,肝气郁结，气机不畅,symptom.json
S224,血证,症状,,血液溢出脉外，如鼻衄、齿衄、咳血、吐血、便血、尿血等,《中医诊断学》,火热迫血妄行或气虚不摄,symptom.json
S225,汗证,症状,,汗出异常，如自汗、盗汗、大汗、黄汗等,《中医诊断学》,阴阳失调，腠理不固,symptom.json
S226,消渴,症状,糖尿病,多饮、多食、多尿、消瘦，或尿有甜味,《中医诊断学》,阴虚燥热，脏腑受损,symptom.json
S227,内伤发热,症状,,非外感因素引起的发热，或低热，或潮热，或五心烦热,《中医诊断学》,气血阴阳亏虚，脏腑功能失调,symptom.json
S228,虚劳,症状,,多种虚损性疾病的总称，表现为气、血、阴、阳亏虚,《中医诊断学》,禀赋不足或久病失养,symptom.json
S229,积聚,症状,,腹内结块，或胀或痛，固定不移（积）或聚散无常（聚）,《中医诊断学》,肝脾失调，气滞血瘀,symptom.json
S230,鼓胀,症状,肝硬化腹水,腹部胀大如鼓，皮色苍黄，或伴腹水、水肿,《中医诊断学》,肝脾肾受损，气滞、血瘀、水停,symptom.json
S231,头痛,症状,,头部疼痛，部位、性质、程度各异,《中医诊断学》,外感或内伤因素导致头部经络不通,symptom.json
S232,眩晕,症状,,头晕眼花，或视物旋转，如坐车船,《中医诊断学》,肝阳上亢或气血亏虚,symptom.json
S233,中风后遗症,症状,,中风后遗留的半身不遂、口眼歪斜、言语不利等,《中医诊断学》,正气亏虚，瘀血阻络,symptom.json
S234,颤证,症状,帕金森病,头部或肢体摇动颤抖，不能自制,《中医诊断学》,肝风内动或筋脉失养,symptom.json
S235,痿证,症状,,肢体痿软无力，肌肉萎缩，甚则不能运动,《中医诊断学》,肺热叶焦或肝肾亏虚,symptom.json
S236,痹证,症状,,肢体关节、筋骨、肌肉疼痛、酸楚、麻木、重着,《中医诊断学》,风寒湿热之邪侵袭经络,symptom.json
S237,腰痛,症状,,腰部一侧或两侧疼痛，或酸胀，或冷痛，或刺痛,《中医诊断学》,肾虚或外邪侵袭,symptom.json
S238,水肿,症状,,水液潴留，泛溢肌肤，引起头面、眼睑、四肢或全身浮肿,《中医诊断学》,肺、脾、肾三脏功能失调,symptom.json
S239,淋证,症状,,小便频数、涩痛、淋漓不畅，或小腹拘急,《中医诊断学》,湿热蕴结下焦，膀胱气化不利,symptom.json
S240,癃闭,症状,,小便量少，点滴而出，或小便闭塞不通,《中医诊断学》,肾阳虚衰或膀胱气化不利,symptom.json
S241,遗精,症状,,不因性生活而精液频繁遗泄，或梦遗，或滑精,《中医诊断学》,肾气不固或相火妄动,symptom.json
S242,阳痿,症状,,阴茎不能勃起，或勃起不坚，或坚而不久，不能完成性交,《中医诊断学》,肾阳不足或肝气郁结,symptom.json
S243,闭经,症状,,女子年逾16岁，月经尚未来潮，或已行经又中断6个月以上,《中医诊断学》,肾虚或血瘀,symptom.json
S244,痛经,症状,,妇女正值经期或行经前后，出现周期性小腹疼痛，或痛引腰骶,《中医诊断学》,寒凝血瘀或气滞血瘀,symptom.json
S245,月经不调,症状,,月经周期、经期、经量发生异常改变,《中医诊断学》,脏腑功能失调，气血不和,symptom.json
S246,带下病,症状,,带下量、色、质、气味异常，或伴全身症状,《中医诊断学》,脾虚湿盛或湿热下注,symptom.json
S247,妊娠恶阻,症状,妊娠呕吐,妊娠早期出现恶心呕吐，甚则食入即吐,《中医诊断学》,胃气上逆，冲气上逆,symptom.json
S248,胎动不安,症状,先兆流产,妊娠期腰酸腹痛，或阴道少量流血，胎动下坠感,《中医诊断学》,肾虚或气血不足,symptom.json
S249,产后身痛,症状,产后关节痛,产褥期间出现肢体关节疼痛、酸楚、麻木,《中医诊断学》,血虚或风寒湿邪侵袭,symptom.json
S250,缺乳,症状,乳汁不足,产后乳汁甚少，或全无，不能满足婴儿哺乳需要,《中医诊断学》,气血亏虚或肝郁气滞,symptom.json
S251,小儿泄泻,症状,小儿腹泻,小儿大便次数增多，粪质稀薄，或如水样,《中医诊断学》,感受外邪或内伤饮食,symptom.json
S252,小儿肺炎喘嗽,症状,小儿肺炎,小儿发热、咳嗽、气喘、鼻翼煽动,《中医诊断学》,外邪犯肺，肺气郁闭,symptom.json
S253,麻疹,症状,,发热、咳嗽、流泪、流涕，口腔出现麻疹黏膜斑，皮肤出现红色斑丘疹,《中医诊断学》,麻毒时邪犯肺,symptom.json
S254,痄腮,症状,,耳下腮部肿胀疼痛，咀嚼时加剧,《中医诊断学》,风热毒邪壅阻少阳,symptom.json
S255,顿咳,症状,百日咳,阵发性痉挛性咳嗽，咳后有鸡鸣样回声,《中医诊断学》,外感时邪，痰热阻肺,symptom.json
S256,疳证,症状,小儿营养不良,小儿形体消瘦，面黄发枯，食欲异常，精神萎靡,《中医诊断学》,脾胃受损，运化失常,symptom.json
S257,夜啼,症状,,小儿夜间啼哭不安，或定时啼哭，或彻夜啼哭,《中医诊断学》,脾寒或心热,symptom.json
S258,胎黄,症状,新生儿黄疸,新生儿时期出现皮肤、面目发黄,《中医诊断学》,湿热蕴蒸或寒湿困脾,symptom.json
S259,鹅口疮,症状,新生儿口腔念珠菌感染,口腔黏膜表面覆盖白色乳凝块样小点或小片状物,《中医诊断学》,心脾积热上熏,symptom.json
S260,脐风,症状,新生儿破伤风,新生儿出现口噤、痉挛、抽搐，呈苦笑面容,《中医诊断学》,断脐不慎，风邪侵入,symptom.json
Z001,心脾两虚,证候,insufficiency of both the heart and the spleen,心血不足兼脾气虚弱，心悸失眠、食少乏力,《中医诊断学》,归脾汤主治,syndrome.json
Z002,心肾不交,证候,breakdown of the normal physiological coordination between the heart and the kidney,心火亢盛、肾水不足，心烦失眠、腰膝酸软,《中医诊断学》,交泰丸主治,syndrome.json
Z003,脾胃气虚,证候,qi deficiency of the spleen and stomach,脾胃运化减退，食少便溏、神疲乏力,《中医诊断学》,四君子汤主治,syndrome.json
Z004,气血两虚,证候,deficiency of both qi and blood,气虚与血虚并存，面色苍白、头晕心悸,《中医诊断学》,八珍汤主治,syndrome.json
Z005,肝血不足,证候,insufficiency of liver blood,肝藏血不足，头晕目眩、虚烦不眠,《中医诊断学》,酸枣仁汤主治,syndrome.json
Z006,阴虚血少,证候,yin deficiency and blood insufficiency,阴液亏虚、血液不足，心悸失眠、手足心热,《中医诊断学》,天王补心丹主治,syndrome.json
Z007,中气下陷,证候,sinking of the middle qi,脾胃气虚升举无力，乏力腹胀、脱肛,《中医诊断学》,补中益气汤主治,syndrome.json
Z008,血虚证,证候,blood deficiency syndrome,血液亏虚，面色苍白、头晕心悸、舌淡脉细,《中医诊断学》,四物汤主治,syndrome.json
Z009,气虚证,证候,qi deficiency syndrome,元气不足，乏力气短、自汗脉弱,《中医诊断学》,四君子汤主治,syndrome.json
Z010,阴虚证,证候,yin deficiency syndrome,阴液不足，口燥咽干、潮热盗汗、舌红少苔,《中医诊断学》,,syndrome.json
Z011,阳虚证,证候,yang deficiency syndrome,阳气不足，畏寒肢冷、舌胖脉沉,《中医诊断学》,,syndrome.json
Z012,肝气郁结,证候,stagnation of liver qi,肝失疏泄，胁痛胸闷、情志抑郁、脉弦,《中医诊断学》,柴胡疏肝散主治,syndrome.json
Z013,肝火炽盛,证候,exuberance of liver fire,肝火上炎，面红目赤、口苦烦躁、舌红苔黄,《中医诊断学》,龙胆泻肝汤主治,syndrome.json
Z014,湿热蕴脾,证候,damp-heat accumulating in the spleen,湿热困脾，腹胀便溏、舌苔黄腻,《中医诊断学》,,syndrome.json
Z015,风寒表证,证候,wind-cold exterior syndrome,风寒外袭，恶寒发热、头痛、苔白脉紧,《中医诊断学》,麻黄汤主治,syndrome.json
Z016,风热表证,证候,wind-heat exterior syndrome,风热犯表，发热口渴、舌红苔黄、脉数,《中医诊断学》,银翘散主治,syndrome.json
Z017,气分热盛,证候,excessive heat in the qi aspect,热入气分，高热口渴、舌红苔黄、脉数,《中医诊断学》,白虎汤主治,syndrome.json
Z018,心火亢盛,证候,exuberance of heart fire,心火内炽，心悸心烦、口舌生疮,《中医诊断学》,黄连解毒汤主治,syndrome.json
Z019,痰湿内阻,证候,internal obstruction by phlegm-dampness,痰湿停聚，脘痞腹胀、痰多苔腻脉滑,《中医诊断学》,二陈汤主治,syndrome.json
Z020,血瘀证,证候,blood stasis syndrome,血行不畅，刺痛固定、舌暗脉涩,《中医诊断学》,血府逐瘀汤主治,syndrome.json
